{
  "schemaVersion": 1,
  "id": "stop-workstation-notifies-the-shell",
  "title": "Stopping the workstation reports a stopped notification",
  "covers": [
    "Stop-workstation cancellation",
    "Notification vocabulary"
  ],
  "profile": {
    "$ref": "../profiles/single-user.json"
  },
  "given": {
    "ports": {
      "AuthProvider": {
        "authenticate": [
          {
            "result": {
              "source": "cache",
              "interactive": false
            }
          }
        ]
      },
      "EC2Provider": {
        "resolveInstance": [
          {
            "result": {
              "id": "i-0aaaaaaaaaaaaaaa1",
              "state": "running"
            }
          }
        ],
        "stopInstance": [
          {
            "result": null
          }
        ]
      },
      "SSMProvider": {
        "waitForSSMOnline": [
          {
            "result": null
          }
        ],
        "startSession": [
          {
            "result": {
              "sessionId": "example-session-0050"
            }
          }
        ]
      },
      "TunnelProvider": {
        "startTunnel": [
          {
            "result": {
              "processIdentifier": 4320
            }
          }
        ]
      },
      "ReadinessProbe": {
        "waitUntilReady": [
          {
            "result": true
          }
        ]
      },
      "SecretsProvider": {
        "fetchSecret": [
          {
            "result": "synthetic-dcv-password"
          }
        ]
      },
      "DCVLauncher": {
        "launch": [
          {
            "result": null
          }
        ]
      }
    }
  },
  "when": [
    {
      "action": "connect"
    },
    {
      "action": "stopWorkstation",
      "afterState": "connected"
    }
  ],
  "expect": {
    "states": [
      "authenticating",
      "resolving",
      "waitingForSSM",
      "tunneling",
      "connected",
      "disconnected"
    ],
    "calls": [
      {
        "port": "EventSink",
        "method": "notify",
        "with": {
          "notification": "connected"
        }
      },
      {
        "port": "EC2Provider",
        "method": "stopInstance",
        "times": 1
      },
      {
        "port": "EventSink",
        "method": "notify",
        "with": {
          "notification": "stopped"
        }
      }
    ],
    "terminal": {
      "state": "disconnected",
      "errorCategory": "none",
      "instanceId": null,
      "tunnelActive": false
    }
  }
}
